{
  "schema_version": "1.0",
  "frame_id": "carla_000123",
  "source": "carla",
  "simulation_frame": 123,
  "timestamp_s": 6.15,
  "coordinate_convention": {
    "world_frame": "carla_world",
    "ego_frame": "x_forward_y_right_z_up",
    "distance_unit": "m",
    "speed_unit": "mps",
    "acceleration_unit": "mps2"
  },
  "ego": {
    "actor_id": "1",
    "position_world_m": {"x": 10.0, "y": 20.0, "z": 0.2},
    "rotation_world_deg": {"pitch": 0.0, "yaw": 0.0, "roll": 0.0},
    "velocity_world_mps": {"x": 10.0, "y": 0.0, "z": 0.0},
    "acceleration_world_mps2": {"x": 0.0, "y": 0.0, "z": 0.0},
    "speed_mps": 10.0,
    "road_id": 12,
    "section_id": 0,
    "lane_id": -1,
    "lane_type": "driving",
    "lane_change": "both",
    "is_junction": false,
    "adjacent_lanes": {
      "left": {
        "road_id": 12,
        "lane_id": -2,
        "lane_type": "driving",
        "is_junction": false
      },
      "right": null
    }
  },
  "objects": [
    {
      "object_id": "carla_actor_42",
      "source_object_id": "42",
      "category": "vehicle",
      "subtype": "vehicle.tesla.model3",
      "position_world_m": {"x": 30.0, "y": 20.0, "z": 0.2},
      "velocity_world_mps": {"x": 6.0, "y": 0.0, "z": 0.0},
      "speed_mps": 6.0,
      "relative_position_ego_m": {"longitudinal": 20.0, "lateral": 0.0, "vertical": 0.0},
      "relative_velocity_ego_mps": {"longitudinal": -4.0, "lateral": 0.0, "vertical": 0.0},
      "distance_m": 20.0,
      "relative_longitudinal_speed_mps": -4.0,
      "closing_speed_mps": 4.0,
      "road_id": 12,
      "lane_id": -1,
      "lane_relation": "ego_lane",
      "is_junction": false,
      "traffic_light_state": null,
      "semantic_matches": [
        {
          "camera_name": "front_rgb",
          "visual_object_id": "vlm_obj_001",
          "bbox_2d": [0.4, 0.35, 0.6, 0.7],
          "description": "red car ahead",
          "confidence": null
        }
      ]
    }
  ],
  "environment": {
    "weather": "clear",
    "visibility": "good",
    "road_type": "urban",
    "is_intersection": false,
    "precipitation_percent": 0.0,
    "fog_density_percent": 0.0,
    "scene_summary": "A vehicle is travelling ahead in the ego lane."
  },
  "sensor_events": {
    "collisions": [],
    "lane_invasions": []
  },
  "provenance": {
    "metric_source": "carla_actor_api",
    "semantic_source": "Qwen2.5-VL-3B-Instruct",
    "camera_names": ["front_rgb"]
  }
}
